{
  "schema_version": "0.1",
  "packet_id": "sherlock:trust-chain-admission-search-packet:demo-runtime-asset-denied",
  "packet_type": "TrustChainAdmissionSearchPacket",
  "admission_response_ref": "trust-chain:admit-artifact-response:legacy-python-ml:denied",
  "artifact": {
    "artifact_type": "RuntimeAsset",
    "artifact_ref": "runtime-asset://lattice-forge/legacy-python-ml@0.0.3",
    "owner_repo": "SocioProphet/lattice-forge"
  },
  "decision": "deny",
  "posture": {
    "source_posture": "provenance_present",
    "package_posture": "blocked",
    "runtime_posture": "blocked",
    "vulnerability_posture": "known_blocking_findings",
    "patch_posture": "patch_required",
    "policy_posture": "failed",
    "agentplane_posture": "missing_verified_replay",
    "promotion_posture": "production_denied"
  },
  "evidence_refs": [
    "scan://lattice-forge/legacy-python-ml/0.0.3/osv-scan.json",
    "vulnerability://osv/GHSA-demo-blocking-001",
    "policy://trust-chain/dependency-admission/regulated-enterprise-production",
    "guardrail:decision:trust-chain-runtime-deny-001"
  ],
  "receipt_refs": [],
  "remediation": [
    {
      "step_id": "patch-runtime-asset",
      "authority": "SocioProphet/lattice-forge",
      "instruction": "Replace or patch the vulnerable package set and emit updated SBOM, VEX, scan, signature, and promotion evidence.",
      "required_before_admission": true
    },
    {
      "step_id": "rerun-agentplane-validation",
      "authority": "SocioProphet/agentplane",
      "instruction": "Run trust-chain validation and replay after the patched RuntimeAsset is available.",
      "required_before_admission": true
    }
  ],
  "query_facets": {
    "decision": "deny",
    "artifact_type": "RuntimeAsset",
    "environment": "production",
    "risk_tier": "regulated_enterprise",
    "missing_evidence": ["sbom", "vex", "verified_replay", "runtime_receipt"],
    "remediation_required": true
  },
  "source_links": [
    {"label": "platform-admission-response", "ref": "trust-chain:admit-artifact-response:legacy-python-ml:denied"},
    {"label": "runtime-evidence", "ref": "runtime-asset://lattice-forge/legacy-python-ml@0.0.3"},
    {"label": "guardrail-decision", "ref": "guardrail:decision:trust-chain-runtime-deny-001"}
  ],
  "non_claims": [
    "Sherlock indexes denied admission evidence for retrieval and remediation workflows; it is not the admission authority.",
    "This packet does not claim vulnerability truth without source evidence refs."
  ]
}
